{"compiler_version":"0.10.0","documents":[{"chunks":[{"end_byte":1082,"field":"body","id":"2adb9be74aacc16e21f62aeee6dd47acb4b6a2228b37090039fd0993f27b2d3f","sha256":"3de232ecda109eb94bc2db6625b803e395ffc2e8bf9559dfd1e2837270c1d8e7","start_byte":1043},{"end_byte":1448,"field":"body","id":"bb622842975650f171a1d5f8fe861980ea17b5d0d3bad82cb2c527bafd65c990","sha256":"a35c96ac4a4fa4ada1afe45f3143f68a3b768215b6f0e512505f7fbead8599b2","start_byte":1084},{"end_byte":1952,"field":"body","id":"9fe6d0c9bd34837f8d9886e14cb2e87d8220ad5acd908a001d405bdaeb29a8b8","sha256":"ceab5de5568480d0ff5587406cf1ebce476de532ec4229e2f3eb98d4f0665804","start_byte":1450},{"end_byte":2176,"field":"body","id":"f3d5950fbea0a247f38e4b4a7192cfd38c434aa11ccde2e7a52fe5729515ec5a","sha256":"a165a4f357aa76341c796fc5e433d1aa79b59c3d8ba6c11f98faffae82faecea","start_byte":1954}],"compile_sha256":"2734864d2400a906859a6b11dd727d12c466266bf5219b81fe0e664fae2c31f5","field_lengths":{"authorityDocs":0,"body":184,"codePath":22,"codeSymbol":5,"codeTest":7,"description":19,"hooks":38,"name":7,"scopes":2,"triggers":24},"fields":{"authorityDocs":[],"body":[],"codePath":["benchmarks/public-benchmark.mjs","scripts/memory-public-assets/.ownmem/ci_latency_lock_needs_machine_scaling.md"],"codeSymbol":["calibrateMachineSpeed","performanceGate"],"codeTest":["test/public-self-test.mjs"],"description":["The P95 latency lock scales by a measured machine factor; absolute budgets fail shared CI runners on hardware speed alone"],"hooks":["CI latency lock","P95 budget scales by a measured machine factor; absolute 5 ms fails shared runners","- [CI latency lock](ci_latency_lock_needs_machine_scaling.md) - P95 budget scales by a measured machine factor; absolute 5 ms fails shared runners"],"name":["ci_latency_lock_needs_machine_scaling"],"scopes":["benchmark","ci"],"triggers":["Performance gate: failed","release-gates red but quality gate passed","P95 over budget on ubuntu or windows runners","machine factor","calibrateMachineSpeed"]},"id":"ci_latency_lock_needs_machine_scaling","metadata":{"applies_to":["all"],"authority":"observed","declared_authority":"observed","last_verified":"2026-08-18","scopes":["benchmark","ci"],"triggers":["Performance gate: failed","release-gates red but quality gate passed","P95 over budget on ubuntu or windows runners","machine factor","calibrateMachineSpeed"],"type":"lesson"},"path":"scripts/memory-public-assets/.ownmem/ci_latency_lock_needs_machine_scaling.md","provenance":{"evidence_root_sha256":null,"l2_hooks":[{"line":3,"path":"scripts/memory-public-assets/.ownmem/MEMORY-general.md","sha256":"f03b67c8cd201ccd0437419b34a523c3a9ffd9b45cfaebbeec23e8adb89483bf"}],"receipt_id":null,"source_commit":null,"topic_path":"scripts/memory-public-assets/.ownmem/ci_latency_lock_needs_machine_scaling.md","topic_sha256":"165829ab0a902aff22c850d0b64cd61d73a16cfde8d802837a873ef327d343c0"},"relations":{"authority_docs":[],"code_evidence":[{"path":"benchmarks/public-benchmark.mjs","symbols":["calibrateMachineSpeed","performanceGate"],"tests":["test/public-self-test.mjs"]}],"history_docs":[],"supersedes":[],"wiki_links":[]},"source_content":"---\nname: ci_latency_lock_needs_machine_scaling\ndescription: The P95 latency lock scales by a measured machine factor; absolute budgets fail shared CI runners on hardware speed alone\nmetadata:\n  node_type: memory\n  type: lesson\n  status: active\n  scopes: [benchmark, ci]\n  applies_to: [all]\n  triggers:\n    - \"Performance gate: failed\"\n    - \"release-gates red but quality gate passed\"\n    - \"P95 over budget on ubuntu or windows runners\"\n    - \"machine factor\"\n    - \"calibrateMachineSpeed\"\n  last_verified: 2026-08-18\n  expires_at: null\n  authority: observed\n  authority_docs: []\n  history_docs: []\n  supersedes: []\n  code_evidence:\n    - path: benchmarks/public-benchmark.mjs\n      symbols: [calibrateMachineSpeed, performanceGate]\n      tests: [test/public-self-test.mjs]\n  evidence:\n    - \"2026-08-16 run 31949549383: windows factor 2.84, budget 14.19 ms, measured P95 5.09 ms, 9/9 jobs green\"\n    - \"2026-08-16 run 31948376256: fixed 5 ms lock, windows global P95 6.72 ms, every quality and determinism lock green, release blocked\"\n---\n\n# CI latency lock needs machine scaling\n\nThe original release gate locked global and per-group P95 at an absolute 5 ms,\ncalibrated on the maintainer's workstation. The first real CI run failed the\nlock on every ubuntu and windows job purely on hardware speed: shared 2-core\nrunners pushed the windows global P95 to 6.72 ms while recall quality,\nabstention, and determinism stayed perfect on all nine jobs.\n\nThe lock exists to catch algorithmic regressions, not to certify runner\nhardware. `calibrateMachineSpeed` therefore times a fixed pure-CPU Unicode\nworkload (untimed warmup, then median of 5 runs; reference 38 ms) and the\nbudget becomes `5 ms x machine factor`. A complexity blowup exceeds any\nhardware factor; a slow runner does not. Per-language/per-script groups get a\n2x allowance on top because their sample counts are small enough that one\nscheduler preemption lands directly on the P95 statistic.\n\nIf the gate fails with quality green, read the printed factor and budgets\nbefore touching thresholds: a genuine regression shows P95 far beyond the\nscaled budget on every platform, not one group barely over on one runner.\n","source_sha256":"165829ab0a902aff22c850d0b64cd61d73a16cfde8d802837a873ef327d343c0","trust":{"action_risk":"R4","authority":"advisory","change":{"base_memory_sha256":null,"mode":"import"},"counterexamples":[],"evidence_kinds":[],"evidence_root_sha256":null,"instruction":{"cannot_authorize_actions":true,"context_role":"untrusted-advisory","instruction_override_detected":false},"integrity":"advisory","integrity_reasons":["receipt-missing"],"issued_at":null,"lifecycle":"advisory","logical_type":"procedural","postconditions":[],"preconditions":[],"receipt_id":null,"source_commit":null,"valid_for":{"commit_range":null,"environments":[],"platforms":[],"semver":null}}},{"chunks":[{"end_byte":920,"field":"body","id":"a1fb0bf2079fcfe44ed662aeb1c9443c32b95be3d5f23cba809741e0e06ada0e","sha256":"b226c52a36708f7bfa58aa251a98e1540fca6f9fbd60f7b75b012e66c69517c8","start_byte":878},{"end_byte":1453,"field":"body","id":"dc1468ea430e1d149b13e3718045ec356d605eb9be79e9de88fc6a01fa8cd931","sha256":"f4712aab09b091f51cd4ecc5fdb50d583c919fe4087a5dde9ef121dad9747584","start_byte":922},{"end_byte":1661,"field":"body","id":"a253a3d4cbe364e0af906b8e7e68dc2c4e099b6d738f320585d8d5780f4bc3a2","sha256":"450cec5974bb730207d3692c7f357e755eb36a32568d9a148d56dbecbb55d79e","start_byte":1455}],"compile_sha256":"2096d298cbb73b247936f9781ca632c1df58088e6a1a7f8ff5f7bd332d92ccc5","field_lengths":{"authorityDocs":0,"body":115,"codePath":19,"codeSymbol":0,"codeTest":0,"description":23,"hooks":41,"name":6,"scopes":1,"triggers":25},"fields":{"authorityDocs":[],"body":[],"codePath":["package-lock.json","scripts/memory-public-assets/.ownmem/lockfile_must_pin_canonical_registry.md"],"codeSymbol":[],"codeTest":[],"description":["package-lock.json resolved URLs must point at registry.npmjs.org; a build host's mirror configuration otherwise leaks into the published lockfile"],"hooks":["Lockfile registry","resolved URLs must pin registry.npmjs.org or the host mirror leaks to consumers","- [Lockfile registry](lockfile_must_pin_canonical_registry.md) - resolved URLs must pin registry.npmjs.org or the host mirror leaks to consumers"],"name":["lockfile_must_pin_canonical_registry"],"scopes":["release"],"triggers":["registry.npmmirror.com in package-lock","mirror URL leaked into lockfile","resolved host is not npmjs","npm ci fetches from an unexpected registry"]},"id":"lockfile_must_pin_canonical_registry","metadata":{"applies_to":["all"],"authority":"observed","declared_authority":"observed","last_verified":"2026-08-16","scopes":["release"],"triggers":["registry.npmmirror.com in package-lock","mirror URL leaked into lockfile","resolved host is not npmjs","npm ci fetches from an unexpected registry"],"type":"lesson"},"path":"scripts/memory-public-assets/.ownmem/lockfile_must_pin_canonical_registry.md","provenance":{"evidence_root_sha256":null,"l2_hooks":[{"line":6,"path":"scripts/memory-public-assets/.ownmem/MEMORY-general.md","sha256":"97bff3e6b9485daa157c8803b1edad3db29fee36568adfed356c7a7dbc7aac6d"}],"receipt_id":null,"source_commit":null,"topic_path":"scripts/memory-public-assets/.ownmem/lockfile_must_pin_canonical_registry.md","topic_sha256":"f035b148c647a44536e59eb8574f2066d070fcf6118aeb9cb23f1cf793b4d6f6"},"relations":{"authority_docs":[],"code_evidence":[{"path":"package-lock.json","symbols":[],"tests":[]}],"history_docs":[],"supersedes":[],"wiki_links":[]},"source_content":"---\nname: lockfile_must_pin_canonical_registry\ndescription: package-lock.json resolved URLs must point at registry.npmjs.org; a build host's mirror configuration otherwise leaks into the published lockfile\nmetadata:\n  node_type: memory\n  type: lesson\n  status: active\n  scopes: [release]\n  applies_to: [all]\n  triggers:\n    - \"registry.npmmirror.com in package-lock\"\n    - \"mirror URL leaked into lockfile\"\n    - \"resolved host is not npmjs\"\n    - \"npm ci fetches from an unexpected registry\"\n  last_verified: 2026-08-16\n  expires_at: null\n  authority: observed\n  authority_docs: []\n  history_docs: []\n  supersedes: []\n  code_evidence:\n    - path: package-lock.json\n      symbols: []\n      tests: []\n  evidence:\n    - \"2026-08-16: caught before the first push; 5 of 6 resolved URLs pointed at npmmirror/huaweicloud mirrors captured from the build host's npm configuration\"\n---\n\n# Lockfile must pin the canonical registry\n\nnpm records whatever registry the installing machine was configured with into\neach `resolved` URL. A build host using a regional mirror silently stamps that\nmirror into the lockfile, so every consumer's `npm ci` fetches from an\nendpoint the project never chose, an